<?xml version="1.0" encoding="UTF-8" standalone="no"?>
<!DOCTYPE Table SYSTEM "hazoma.dtd">
<Table name="hazoma">
    <ID type="int">
        <Record>0</Record>
        <Record>1</Record>
    </ID>
    <name type="varchar">
        <Record>'kareem'</Record>
        <Record>'hazoma'</Record>
    </name>
    <age type="int">
        <Record>25</Record>
        <Record>15</Record>
    </age>
</Table>
